{
  "$schema": "http://json-schema.org/draft-07/schema#",
  "$id": "https://github.com/lleonardogr/sphinx-vscode/blob/main/schemas/challenge.schema.json",
  "title": "Sphinx challenge",
  "description": "Metadata, rules and tests for one challenge. Lives in challenges/<id>/challenge.json next to description.md, Starter.java, Starter.classic.java, Solution.java and Solution.classic.java. Guide: docs/creating-challenges.md",
  "type": "object",
  "required": [
    "title",
    "tests"
  ],
  "additionalProperties": false,
  "properties": {
    "$schema": {
      "type": "string"
    },
    "id": {
      "type": "string",
      "pattern": "^[a-z0-9]+(-[a-z0-9]+)*$",
      "description": "Unique id. Defaults to the folder name, which is recommended: leave this out."
    },
    "title": {
      "type": "string",
      "minLength": 1,
      "description": "Name shown in the sidebar and at the top of the problem panel."
    },
    "topic": {
      "type": "string",
      "minLength": 1,
      "description": "Sidebar unit. The built-in units, in teaching order: Basics, Conditionals, Loops, Strings, Methods, Arrays, Collections, OOP, Exceptions, Recursion and Streams. Use \"Tests\" for a bigger mixed challenge (and set \"unit\"). Any other name works too and gets its own group after the units. Leave it out to put the challenge in the Custom section at the bottom.",
      "examples": [
        "Basics",
        "Conditionals",
        "Loops",
        "Strings",
        "Methods",
        "Arrays",
        "Collections",
        "OOP",
        "Exceptions",
        "Recursion",
        "Streams",
        "Tests"
      ]
    },
    "skills": {
      "type": "array",
      "items": {
        "type": "string",
        "minLength": 1
      },
      "uniqueItems": true,
      "description": "Topics this challenge combines, shown as badges in the panel and the sidebar tooltip. Useful for mixed challenges in the \"Tests\" group, e.g. [\"Variables\", \"Conditionals\", \"Loops\"].",
      "examples": [
        [
          "Variables",
          "Conditionals",
          "Loops"
        ]
      ]
    },
    "unit": {
      "type": "string",
      "description": "For \"Tests\" only: the unit this test closes. It is listed at the end of that unit, after its quiz. Without it, the test goes to the Custom section.",
      "examples": [
        "Basics",
        "Conditionals",
        "Loops",
        "Strings",
        "Methods",
        "Arrays",
        "Collections",
        "OOP",
        "Exceptions",
        "Recursion",
        "Streams"
      ]
    },
    "requires": {
      "type": "array",
      "items": {
        "type": "string"
      },
      "description": "Units the student should know first, by unit key (for example \"Loops\" from Java Programming). Shown with the student's progress in each unit; never enforced."
    },
    "subject": {
      "type": "string",
      "description": "The subject (for example \"cs\"), for content without a unit. Otherwise the unit decides the subject."
    },
    "difficulty": {
      "type": "string",
      "enum": [
        "Easy",
        "Medium",
        "Hard"
      ],
      "default": "Easy",
      "description": "Shown next to the title."
    },
    "order": {
      "type": "number",
      "default": 0,
      "description": "Position inside the topic (lower comes first)."
    },
    "hints": {
      "type": "array",
      "items": {
        "type": "string"
      },
      "description": "Hints revealed one at a time, from gentle to specific. Plain text."
    },
    "translations": {
      "type": "object",
      "description": "Translations of the texts, by language (for example \"pt-br\"). The description goes in description.<lang>.md and translated starters in Starter.<lang>.java / Starter.classic.<lang>.java. Tests and solutions are shared: the program prints the same output in every language.",
      "patternProperties": {
        "^[a-z]{2}(-[a-z]{2})?$": {
          "type": "object",
          "additionalProperties": false,
          "properties": {
            "title": {
              "type": "string"
            },
            "hints": {
              "type": "array",
              "items": {
                "type": "string"
              },
              "description": "Same number of hints as the original."
            },
            "mustContain": {
              "type": "array",
              "items": {
                "type": "string"
              },
              "description": "The rule messages, in the same order as mustContain."
            },
            "mustNotContain": {
              "type": "array",
              "items": {
                "type": "string"
              },
              "description": "The rule messages, in the same order as mustNotContain."
            },
            "bonus": {
              "type": "array",
              "description": "The bonus goals' texts, in the same order: title, description, hint and rule messages.",
              "items": {
                "type": "object",
                "properties": {
                  "title": {
                    "type": "string"
                  },
                  "description": {
                    "type": "string"
                  },
                  "hint": {
                    "type": "string"
                  },
                  "mustContain": {
                    "type": "array",
                    "items": {
                      "type": "string"
                    }
                  },
                  "mustNotContain": {
                    "type": "array",
                    "items": {
                      "type": "string"
                    }
                  }
                }
              }
            }
          }
        }
      },
      "additionalProperties": false
    },
    "mustContain": {
      "type": "array",
      "items": {
        "$ref": "#/definitions/rule"
      },
      "description": "Every pattern must match the student's code (comments are ignored), otherwise the message is shown and tests don't run."
    },
    "mustNotContain": {
      "type": "array",
      "items": {
        "$ref": "#/definitions/rule"
      },
      "description": "No pattern may match the student's code (comments are ignored)."
    },
    "timeLimitMs": {
      "type": "number",
      "minimum": 500,
      "default": 5000,
      "description": "Time limit per test in milliseconds, including JVM startup."
    },
    "aiHints": {
      "type": "boolean",
      "default": true,
      "description": "Set to false to disable AI hints for this challenge (for example in an exam)."
    },
    "tests": {
      "type": "array",
      "minItems": 1,
      "items": {
        "$ref": "#/definitions/test"
      },
      "description": "Test cases. Visible tests appear as examples and run on Run; hidden tests only run on Submit."
    },
    "language": {
      "enum": [
        "java",
        "c"
      ],
      "description": "The programming language. By default C when the folder has Starter.c or Solution.c, Java otherwise."
    },
    "bonus": {
      "type": "array",
      "maxItems": 3,
      "description": "Optional, harder goals checked on Submit once the tests pass: a different approach, more efficiency, a constraint or more robustness. Each needs a reference solution, Solution.bonus.<id>.java (or .c), that earns it.",
      "items": {
        "type": "object",
        "required": [
          "id",
          "title",
          "description"
        ],
        "properties": {
          "id": {
            "type": "string",
            "pattern": "^[a-z0-9]+(-[a-z0-9]+)*$",
            "description": "Lowercase with dashes, such as \"no-loops\". Names the reference solution file."
          },
          "title": {
            "type": "string",
            "description": "Short, such as \"Without loops\"."
          },
          "description": {
            "type": "string",
            "description": "What to achieve, in one sentence."
          },
          "hint": {
            "type": "string"
          },
          "mustContain": {
            "type": "array",
            "items": {
              "$ref": "#/definitions/rule"
            }
          },
          "mustNotContain": {
            "type": "array",
            "items": {
              "$ref": "#/definitions/rule"
            }
          },
          "tests": {
            "type": "array",
            "items": {
              "$ref": "#/definitions/test"
            },
            "description": "Extra tests (never shown to students), such as a huge input."
          },
          "timeLimitMs": {
            "type": "number",
            "description": "A time limit for these tests, for efficiency goals. Leave generous room: the right approach should take well under it, the naive one far longer."
          }
        },
        "additionalProperties": false
      }
    }
  },
  "definitions": {
    "rule": {
      "type": "object",
      "required": [
        "pattern",
        "message"
      ],
      "additionalProperties": false,
      "properties": {
        "pattern": {
          "type": "string",
          "format": "regex",
          "description": "JavaScript regular expression (multiline mode). Remember to double backslashes in JSON: \"\\\\bfor\\\\b\"."
        },
        "message": {
          "type": "string",
          "description": "Shown to the student when the rule fails, and listed under Requirements in the panel."
        }
      }
    },
    "test": {
      "type": "object",
      "required": [
        "output"
      ],
      "additionalProperties": false,
      "properties": {
        "input": {
          "type": "string",
          "description": "Exactly what the program receives on standard input. End lines with \\n. Leave out when the test has \"generate\"."
        },
        "output": {
          "type": "string",
          "description": "Expected standard output. Trailing spaces and trailing blank lines are ignored. Leave empty and run \"Validate Challenges → fill in expected outputs\" to generate it from Solution.java."
        },
        "hidden": {
          "type": "boolean",
          "default": false,
          "description": "Hidden tests run only on Submit and never reveal their input. Use them for edge cases. Tests with \"generate\" are always hidden."
        },
        "generate": {
          "$ref": "#/definitions/generate"
        }
      },
      "oneOf": [
        {
          "required": [
            "input"
          ],
          "not": {
            "required": [
              "generate"
            ]
          }
        },
        {
          "required": [
            "generate"
          ],
          "not": {
            "required": [
              "input"
            ]
          }
        }
      ]
    },
    "generate": {
      "type": "object",
      "required": [
        "seed",
        "lines"
      ],
      "additionalProperties": false,
      "description": "Builds a big input instead of storing it, to test efficiency (for example 100000 numbers). The same seed always gives the same input. At most 2 000 000 numbers or characters. Keep the expected output short, such as a count or a sum: outputs over 256 KB are cut.",
      "properties": {
        "seed": {
          "type": "integer",
          "description": "Any whole number; change it for a different input."
        },
        "lines": {
          "type": "array",
          "minItems": 1,
          "description": "The input's lines: text as it is, or a recipe for numbers or characters.",
          "items": {
            "anyOf": [
              {
                "type": "string"
              },
              {
                "type": "object",
                "required": [
                  "ints",
                  "min",
                  "max"
                ],
                "additionalProperties": false,
                "properties": {
                  "ints": {
                    "type": "integer",
                    "minimum": 1,
                    "description": "How many numbers per line, separated by spaces."
                  },
                  "min": {
                    "oneOf": [
                      {
                        "type": "integer"
                      },
                      {
                        "type": "array",
                        "items": {
                          "type": "integer"
                        },
                        "minItems": 1
                      }
                    ],
                    "description": "The smallest possible number, or a list with one per column."
                  },
                  "max": {
                    "oneOf": [
                      {
                        "type": "integer"
                      },
                      {
                        "type": "array",
                        "items": {
                          "type": "integer"
                        },
                        "minItems": 1
                      }
                    ],
                    "description": "The largest possible number, or a list with one per column."
                  },
                  "rows": {
                    "type": "integer",
                    "minimum": 1,
                    "default": 1,
                    "description": "How many lines like this."
                  },
                  "sorted": {
                    "type": "boolean",
                    "default": false,
                    "description": "Each line in ascending order (only with one range for every number)."
                  },
                  "distinct": {
                    "type": "boolean",
                    "default": false,
                    "description": "No number repeated within a line (only with one range for every number)."
                  }
                }
              },
              {
                "type": "object",
                "required": [
                  "chars",
                  "alphabet"
                ],
                "additionalProperties": false,
                "properties": {
                  "chars": {
                    "type": "integer",
                    "minimum": 1,
                    "description": "How many characters per line."
                  },
                  "alphabet": {
                    "type": "string",
                    "minLength": 1,
                    "description": "The characters to draw from. Repeat one to make it more common, such as \".....#\" for a grid that is one-sixth walls."
                  },
                  "rows": {
                    "type": "integer",
                    "minimum": 1,
                    "default": 1,
                    "description": "How many lines like this."
                  }
                }
              }
            ]
          }
        }
      },
      "examples": [
        {
          "seed": 7,
          "lines": [
            "100000",
            {
              "ints": 100000,
              "min": 1,
              "max": 1000000000
            }
          ]
        }
      ]
    }
  }
}
