{
  "title": "Palindrome Check",
  "topic": "Strings",
  "difficulty": "Medium",
  "order": 5,
  "hints": [
    "Convert the word with toLowerCase() first.",
    "Compare the first character with the last, the second with the second-to-last, and so on.",
    "Comparing Strings: use a.equals(b), never a == b."
  ],
  "translations": {
    "pt-br": {
      "title": "É palíndromo?",
      "hints": [
        "Primeiro converta a palavra com toLowerCase().",
        "Compare o primeiro caractere com o último, o segundo com o penúltimo, e assim por diante.",
        "Para comparar Strings, use a.equals(b), nunca a == b."
      ],
      "mustNotContain": [
        "Resolva com um laço ou montando a palavra invertida você mesmo: o reverse() pronto não é permitido."
      ],
      "bonus": [
        {
          "title": "Frases inteiras",
          "description": "Aceite frases inteiras: compare só letras e dígitos, ignorando maiúsculas, espaços e pontuação, para `Never odd or even` ser um palíndromo.",
          "hint": "Ande com dois índices a partir das pontas e pule qualquer caractere que não seja letra ou dígito: Character.isLetterOrDigit(c)."
        }
      ]
    }
  },
  "mustNotContain": [
    {
      "pattern": "\\.reverse\\s*\\(",
      "message": "Solve it with a loop or by building the reversed word yourself: the built-in reverse() is not allowed."
    }
  ],
  "tests": [
    {
      "input": "Racecar\n",
      "output": "Palindrome\n"
    },
    {
      "input": "Java\n",
      "output": "Not a palindrome\n"
    },
    {
      "input": "a\n",
      "output": "Palindrome\n",
      "hidden": true
    },
    {
      "input": "Noon\n",
      "output": "Palindrome\n",
      "hidden": true
    },
    {
      "input": "ab\n",
      "output": "Not a palindrome\n",
      "hidden": true
    },
    {
      "input": "abcba\n",
      "output": "Palindrome\n",
      "hidden": true
    },
    {
      "input": "abca\n",
      "output": "Not a palindrome\n",
      "hidden": true
    }
  ],
  "bonus": [
    {
      "id": "sentences",
      "title": "Whole sentences",
      "description": "Accept whole sentences: compare only letters and digits, ignoring case, spaces and punctuation, so `Never odd or even` is a palindrome.",
      "hint": "Walk two indexes from the ends and skip any character that isn't a letter or digit: Character.isLetterOrDigit(c).",
      "tests": [
        {
          "input": "Never odd or even\n",
          "output": "Palindrome\n"
        },
        {
          "input": "A man, a plan, a canal: Panama!\n",
          "output": "Palindrome\n"
        },
        {
          "input": "Hello, world\n",
          "output": "Not a palindrome\n"
        },
        {
          "input": "No lemon, no melon.\n",
          "output": "Palindrome\n"
        }
      ]
    }
  ]
}
