{
  "title": "Truth Table",
  "topic": "Logic",
  "requires": [
    "Loops",
    "Conditionals"
  ],
  "difficulty": "Easy",
  "order": 1,
  "hints": [
    "Two nested loops, each from 0 to 1, give the four rows: 0 0, 0 1, 1 0, 1 1.",
    "Turn the 0/1 values into booleans (a == 1) and use &&, || and ^. NAND is !(a && b) and NOR is !(a || b).",
    "Check the gate name before printing anything, so an unknown gate prints only its message."
  ],
  "translations": {
    "pt-br": {
      "title": "Tabela-verdade",
      "hints": [
        "Dois laços aninhados, cada um de 0 a 1, dão as quatro linhas: 0 0, 0 1, 1 0, 1 1.",
        "Transforme os valores 0/1 em booleanos (a == 1) e use &&, || e ^. NAND é !(a && b) e NOR é !(a || b).",
        "Confira o nome da porta antes de imprimir qualquer coisa, para que uma porta desconhecida imprima só a mensagem."
      ],
      "mustContain": [
        "Use laços para percorrer as entradas."
      ]
    }
  },
  "mustContain": [
    {
      "pattern": "\\b(for|while)\\b",
      "message": "Use loops to go through the inputs."
    }
  ],
  "tests": [
    {
      "input": "AND\n",
      "output": "A B OUT\n0 0 0\n0 1 0\n1 0 0\n1 1 1\n"
    },
    {
      "input": "XOR\n",
      "output": "A B OUT\n0 0 0\n0 1 1\n1 0 1\n1 1 0\n"
    },
    {
      "input": "OR\n",
      "output": "A B OUT\n0 0 0\n0 1 1\n1 0 1\n1 1 1\n",
      "hidden": true
    },
    {
      "input": "NAND\n",
      "output": "A B OUT\n0 0 1\n0 1 1\n1 0 1\n1 1 0\n",
      "hidden": true
    },
    {
      "input": "NOR\n",
      "output": "A B OUT\n0 0 1\n0 1 0\n1 0 0\n1 1 0\n",
      "hidden": true
    },
    {
      "input": "XNOR\n",
      "output": "Unknown gate: XNOR\n",
      "hidden": true
    },
    {
      "input": "and\n",
      "output": "Unknown gate: and\n",
      "hidden": true
    }
  ]
}
