{
  "title": "Exam Scores",
  "topic": "Sorting",
  "requires": [
    "Arrays",
    "Loops"
  ],
  "difficulty": "Easy",
  "order": 1,
  "hints": [
    "There are only 101 possible scores. Make an int array with one counter per score.",
    "counts[score]++ for every score. Then walk the array from 100 down to 0 and print the scores whose counter isn't 0.",
    "For the median, walk the counters from 0 upwards, adding them up, until the running total passes position (n − 1) / 2."
  ],
  "translations": {
    "pt-br": {
      "title": "Notas da prova",
      "hints": [
        "Só existem 101 notas possíveis. Faça um array de int com um contador por nota.",
        "counts[nota]++ para cada nota. Depois percorra o array de 100 até 0 e imprima as notas cujo contador não é 0.",
        "Para a mediana, percorra os contadores de 0 para cima, somando, até o total passar da posição (n − 1) / 2."
      ],
      "mustNotContain": [
        "Conte as notas num array em vez de ordená-las."
      ]
    }
  },
  "mustNotContain": [
    {
      "pattern": "\\bsort\\b|sorted\\s*\\(|\\b(TreeMap|TreeSet|PriorityQueue)\\b",
      "message": "Count the scores in an array instead of sorting them."
    }
  ],
  "tests": [
    {
      "input": "7\n70 85 70 100 55 85 70\n",
      "output": "100: 1\n85: 2\n70: 3\n55: 1\nmedian: 70\n"
    },
    {
      "input": "4\n10 20 30 40\n",
      "output": "40: 1\n30: 1\n20: 1\n10: 1\nmedian: 20\n"
    },
    {
      "input": "1\n0\n",
      "output": "0: 1\nmedian: 0\n",
      "hidden": true
    },
    {
      "input": "5\n100 100 100 100 100\n",
      "output": "100: 5\nmedian: 100\n",
      "hidden": true
    },
    {
      "input": "6\n50 0 100 50 0 100\n",
      "output": "100: 2\n50: 2\n0: 2\nmedian: 50\n",
      "hidden": true
    },
    {
      "input": "3\n99 1 50\n",
      "output": "99: 1\n50: 1\n1: 1\nmedian: 50\n",
      "hidden": true
    },
    {
      "generate": {
        "seed": 51,
        "lines": [
          "200000",
          {
            "ints": 200000,
            "min": 0,
            "max": 100
          }
        ]
      },
      "output": "100: 2005\n99: 1992\n98: 2012\n97: 2006\n96: 1958\n95: 2037\n94: 2022\n93: 2003\n92: 2007\n91: 2001\n90: 2007\n89: 1962\n88: 2039\n87: 2043\n86: 1991\n85: 1891\n84: 1906\n83: 2008\n82: 2012\n81: 1975\n80: 1894\n79: 1970\n78: 2042\n77: 1982\n76: 2004\n75: 1946\n74: 1945\n73: 2021\n72: 2048\n71: 1975\n70: 1916\n69: 1927\n68: 1938\n67: 2035\n66: 2010\n65: 2000\n64: 2057\n63: 1973\n62: 2030\n61: 1888\n60: 1890\n59: 1980\n58: 1907\n57: 1976\n56: 1972\n55: 2001\n54: 2002\n53: 2011\n52: 2038\n51: 2004\n50: 1962\n49: 1965\n48: 1960\n47: 1946\n46: 1988\n45: 2054\n44: 1915\n43: 2045\n42: 1943\n41: 1967\n40: 2001\n39: 2002\n38: 1976\n37: 1973\n36: 1990\n35: 1977\n34: 1985\n33: 1972\n32: 2034\n31: 1939\n30: 1928\n29: 1987\n28: 1959\n27: 1933\n26: 1980\n25: 1976\n24: 2003\n23: 1898\n22: 1974\n21: 1916\n20: 1975\n19: 1948\n18: 2028\n17: 2066\n16: 1984\n15: 2029\n14: 1993\n13: 1965\n12: 1940\n11: 1879\n10: 2069\n9: 1900\n8: 2013\n7: 1971\n6: 2021\n5: 1936\n4: 1950\n3: 1994\n2: 1975\n1: 1963\n0: 1994\nmedian: 50\n",
      "hidden": true
    },
    {
      "generate": {
        "seed": 52,
        "lines": [
          "200000",
          {
            "ints": 200000,
            "min": 40,
            "max": 60
          }
        ]
      },
      "output": "60: 9469\n59: 9472\n58: 9426\n57: 9380\n56: 9630\n55: 9713\n54: 9580\n53: 9363\n52: 9571\n51: 9625\n50: 9660\n49: 9580\n48: 9584\n47: 9549\n46: 9436\n45: 9364\n44: 9544\n43: 9577\n42: 9428\n41: 9528\n40: 9521\nmedian: 50\n",
      "hidden": true
    }
  ]
}
